STERIS Corporation,http://www.steris.com,"STERIS is a $1B+, publicly traded (NYSE) organization of over 5000 employees and is dedicated to providing innovative infection prevention, decontamination, and health science technologies, products and services.  STERIS Corporation is an equal opportunity/affirmative action employer.",Stephen Webster,Senior Recruiting Representative,"5960 Heisley RoadMentor, OH 44060",440-392-7236,,stephen_webster@steris.com,Full Time,Bachelors;Masters;Doctoral,,Biochemistry;Biology/Systems Biology/Evolutionary Biology;Chemistry/Natural Sciences,Electrical;Mechanical;Computer Science,All Weatherhead,,N,"Mentor, OH"
General Electric Company,http://www.ge.com/careers,"GE is a diversified infrastructure, finance and media company taking on the world's toughest challenges. From aircraft engines and power generation to financial services, medical imaging, and television programming, GE operates in more than 100 countries and employs about 300,000 people worldwide.",Dale Mikol,Campus Recruiting Leader,"1975 Noble RoadBldg 335CEast Cleveland, Ohio44112",216-266-9746,216-266-2819,dale.mikol@ge.com,Full Time;Co-op;Internship,Bachelors;Masters;Doctoral,,,Aerospace;Chemical;Computer Engineering;Electrical;Engineering Physics (U);Fluid and Thermal (G);Macromolecular Science (G);Materials Science;Mechanical;Polymer Science;Systems & Control;Master of Engineering Management (G);Computer Science;Engineering Mechanics (G),,,N,Various
The Goodyear Tire & Rubber Company,http://www.goodyear.com,"Goodyear is one of the world's largest tire companies. A Fortune 500 company, we employ nearly 70,000 people and manufacture our products in 57 facilities in 23 countries around the world. We have built our foundation on a commitment to forward-thinking innovation, and our industry-leading new product engine helps us bring new products to market that feature the latest advances in materials and technologies. At Goodyear, we embrace the diversity of our workforce and value the contribution of our employees. We strive to provide associates with a safe work environment, the resources they need to do their jobs and ample opportunities for growth. These objectives, coupled with competitive compensation and benefits, allow us to foster an environment where associates can work to achieve their full potential and contribute to the company's success. For more information, go to www.goodyear.com.",Natalie Smith,Campus Team Associate,"3401 Technology Drive      Findlay, OH                             45840 ",866-713-0051,,natalie.smith@rightthinginc.com,Full Time;Co-op;Internship,Bachelors;Masters,,,All Engineering,,,N,"Akron, OH"
Internal Revenue Service,http://www.irs.gov,"Bring your talents to an organization making your nation stronger everyday. The IRS’s work funds America, and our dedicated employees make it all possible. You’ll be challenged, supported and will enjoy work-life balance. The IRS is one of the largest financial institutions in the world with one of the most well-trained workforces anywhere. While working at the IRS, you may choose to explore a career path offering unexpected and exciting opportunities – such as analyst positions, jobs in the technical field, management positions or a career as an IRS executive. Where you go is up to you.",Peggy Nypaver,Corporate Recruiter,"200 N. High Street, Room 403, Columbus, OH  43215",614-280-8864,,Margaret.I.Nypaver@irs.gov,Full Time,Bachelors;Masters,,,,Accounting/Accountancy;All Weatherhead,,N,Toledo and many other locations nationwide
OverDrive Inc. ,http://www.overdrive.com/,"OverDrive provides world-class infrastructure for distributing premium digital content. We empower publishers, enterprises, libraries, schools, and retailers to maximize their presences in the digital world by enabling them to securely manage, protect, and lend or sell digital audiobooks, eBooks, music, and videos. If you want a career that is challenging and allows you to stretch and flex those brain muscles you've worked so hard to build--while having some fun as well--consider joining OverDrive. The digital entertainment industry is evolving rapidly and you would have the chance to dive right in and make a difference. What that means is that early in your career at OverDrive, you would have the opportunity to manage mission-critical projects. Your success, and your team's, is cause for celebration, earning you the respect of the industry and the gratitude of the millions of people who use the products we create.",Mike Dresch,Corporate Recruiter,"8555 Sweet Valley Drive Cleveland, OH 44125",216-573-6886,,mdresch@overdrive.com,Full Time;Co-op;Internship,Bachelors;Masters,,Communication Sciences (disorders)/Cognitive Sciences;English/Classics/Literature,Computer Engineering;Computer Science;All Engineering,All Weatherhead,,N,"Valley View, Ohio"
Alcoa,http://www.alcoa.com,"Alcoa is the world’s leading producer of primary aluminum, fabricated aluminum and alumina. In addition to inventing the modern-day aluminum industry, Alcoa innovation has been behind major milestones in the aerospace, automotive, packaging, building and construction, commercial transportation, consumer electronics and industrial markets over the past 120 years. Among the solutions Alcoa markets are flat-rolled products, hard alloy extrusions, and forgings, as well as Alcoa® wheels, fastening systems, precision and investment castings, and building systems in addition to its expertise in other light metals such as titanium and nickel-based super alloys. Alcoa has been a member of the Dow Jones Sustainability Index for nine consecutive years and approximately 75 percent of all of the aluminum ever produced since 1888 is still in active use today. Alcoa employs approximately 59,000 people in 31 countries across the world. ",Mitzi Chiple,Recruiter,"6450 Rockside Woods Blvd S.Suite 350Independence, OH 44131",216-641-4408,216-641-5353,mitzi.chiple@alcoa.com,Full Time;Internship,Bachelors,,,Aerospace;Computer Engineering;Electrical;Materials Science;Mechanical;Master of Engineering Management (G),Accounting/Accountancy;Organizational Behavior (G);Supply Chain (G);Management -- Finance (U);Management -- Marketing (U),,Y,United States 
The Goodyear Tire & Rubber Company,http://www.goodyear.com,"Goodyear is one of the world's largest tire companies. A Fortune 500 company, we employ nearly 70,000 people and manufacture our products in 57 facilities in 23 countries around the world. We have built our foundation on a commitment to forward-thinking innovation, and our industry-leading new product engine helps us bring new products to market that feature the latest advances in materials and technologies. At Goodyear, we embrace the diversity of our workforce and value the contribution of our employees. We strive to provide associates with a safe work environment, the resources they need to do their jobs and ample opportunities for growth. These objectives, coupled with competitive compensation and benefits, allow us to foster an environment where associates can work to achieve their full potential and contribute to the company's success. For more information, go to www.goodyear.com.",Natalie Smith,Campus Team Associate,"3401 Technology Drive  Findlay,OH 45840",866-713-0051,,natalie.smith@rightthinginc.com,Full Time;Internship,Bachelors;Masters,,,Computer Engineering;Computer Science,,,N,"Akron,OH"
The Timken Company,http://www.timken.com,"Wherever there is motion, you'll find Timken at work. Timken is one of the world's leading producers of highly engineered antifriction bearings and related products and services and alloy steel and components. We help create, transfer and control power, putting our friction management and power transmission technologies to work across a broad industry spectrum. Timken has operations in 26 countries on six continents, and our team of 17,000 employees is dedicated to improving our customers' performance in a variety of applications. Timken is Where You Turn™ for better performance.  Looking for a rewarding career? Timken is where you turn.",Pedro Velis,Manager - University Relations,"1835 Deuber Ave BIC-11Canton, Oh 44706",330-471-3182,330-471-4289,university.relations@timken.com,Internship,Bachelors,,,Aerospace;Chemical;Electrical;Materials Science;Mechanical;Computer Science,Accounting/Accountancy;Finance (G);Supply Chain (G);Management -- Finance (U);Management -- Marketing (U),,N,"Canton, Oh"
Center for Civic Engagement & Learning,http://studentaffairs.case.edu/civicengagement/,The mission of the Center for Civic Engagement & Learning (CCEL) is to create an engaged campus by providing and supporting opportunities for community service and collective action while promoting civic awareness and leadership.  CCEL coordinates both volunteer and paid opportunities for Case Western Reserve University students throughout the year. ,Angela Lowery,Student Service Coordinator,Thwing Center A-05,216-368-6960,216-368-0839,als138@case.edu,Internship,Bachelors,All Majors,,,,,Y,"Cleveland, Ohio"
Wellman Hill Political Science Internship Grants,http://politicalscience.case.edu/wellman/index.htm,"Wellman Hill Political Science Internship Grants are made possible by a generous gift from Elizabeth Hill (B.A., M.A. 1997) to honor her grandfather, Wellman Hill. They are intended to enable Political Science majors to accept public service summer internships that financial limitations might otherwise force them to decline. The selection committee is prepared to give five students up to $4000 each.  ",Elliot Posner,Associate Prof. of Political Science,"Dept. of Political ScienceCWRU10900 Euclid Ave.Cleveland, Ohio 44106",216-368-1015,,eap26@case.edu,Internship,Bachelors,,Political Science,,,,Y,anywhere
MIM Software Inc.,http://www.mimsoftware.com,"MIM Software Inc. provides practical imaging solutions in the fields of radiation oncology, radiology, nuclear medicine, neuroimaging, and cardiac imaging.  MIM offers solutions for PC and Mac workstations, as well as mobile iOS and cloud-based platforms.  MIM sells its products globally to imaging centers, hospitals, specialty clinics, research organizations, and pharmaceutical companies.",Pete Simmelink,Operations,"25200 Chagrin Blvd. Suite 200Cleveland, OH 44122",216-455-0600,216-455-0601,jobs@mimsoftware.com,Full Time;Co-op;Internship,Bachelors;Masters,,,Computer Engineering;Computer Science,,,N,"Cleveland, OH"
"Keithley Instruments, Inc.",http://www.keithley.com,"Keithley Instruments, Inc. designs, develops, manufactures and markets complex electronic instruments and systems geared to the specialized needs of electronics manufacturers for high-performance production testing, process monitoring, product development and research. The Company has approximately 500 products used to source, measure, connect, control or communicate direct current (DC), or optical signals. Product offerings include integrated systems solutions, along with instruments and personal computer (PC) plug-in boards that can be used as system components or stand-alone solutions. The Company's customers are engineers, technicians and scientists in manufacturing, product development and research functions. ",Sabrina Kropp,Corporate Training Manager,"28775 Aurora RdSolon, OH 44139",440-248-0400,440-248-6168,skropp@keithley.com,Co-op,Bachelors;Masters,,,Computer Engineering;Electrical;Computer Science,,,Y,"Cleveland, OH"
Peace Corps,http://www.peacecorps.gov/,"Peace Corps service is a life-defining leadership experience. Since 1961, the Peace Corps has shared with the world America's most precious resource – its people. Volunteers serve in 77 countries in Africa, Asia, the Caribbean, Central and South America, Europe, and the Middle East. Peace Corps Volunteers live, learn, and work with a community overseas for 27 months, providing technical assistance in six program areas: education, youth and community development, health, business and information and communications technology, agriculture, and environment.To apply, you must be at least 18 years of age and a US citizen.",Annabel Khouri,Recruiter,"14837 Detroit Ave, #372Lakewood, OH 44107",216-527-8170,,akhouri@peacecorps.gov,Part-Time,Bachelors;Masters;Doctoral,All Majors,,,,,N,"Africa, Latin Amer, Asia, Pacific, Eastern Europe, Caribbean"
DataBasics Inc,http://www.databasics.com,"Data-Basics creates, sells, installs  and supports its integrated service management software, facilities management software, job costing, accounting and field service software.  For more than thirty six years, thousands of users have relied on our software solutions from a wide range of industries, including: HVAC, field service, telecom, construction, facilities maintenance, national accounts and many more.  Headquartered in the Cleveland area (and founded by CWRU graduates), DataBasics is an exciting place to work.  We are looking for energetic talent to help us create and re-engineer our products so that we can maintain our lead in our industry.  ",David Jack,President,9450 Midwest AveGarfield Hts OH 44125,216-663-5600,,djack@databasics.com,Full Time;Internship,Bachelors;Masters,,Mathematics/Statistics,Computer Engineering;Computer Science,,,N,"Garfield Heights, OH"
Attevo,http://www.attevo.com,"Attevo is a global business and information technology consulting firm. Our purpose is to increase our clients' profitability, service and quality by helping them leverage technology to improve their business focus, processes and relationships with their customers, partners and employees.",Adrianne Houston,Technical Recruiter,"1375 E. 9th street, suite 2500Cleveland, Ohio 44114",216-928-2800,,ahouston@attevo.com,Full Time,Bachelors,,,Computer Engineering;Computer Science,MBA (G),,Y,"Cleveland, OH"
"TOA Technologies, Inc",http://www.toatech.com,"TOA Technologies is the leading provider of Cloud-based mobile workforce management applications for large and medium-sized enterprises. TOA's patented platform improves customer service while dramatically reducing operational costs and delivering immediate return on investment. As the industry's only complete on-demand solution using predictive, time-based analytics, TOA reduces customer wait times while increasing field workforce efficiency. TOA's system deploys quickly, is highly configurable and is easily integrated with existing CRM solutions. Named Best of Breed and Visionary solution in Gartner's 2010 Magic Quadrant for Field Service Management and 2010 Weatherhead 100 #1 Top Growth Company in Northeast Ohio.  TOA Technologies is headquartered in the United States and has offices in Europe and Latin America. ",Jeff Walker,Recruiting Manager,"3333 Richmond RdBeachwood, OH  44122",216-925-5985,,jeff.walker@toatech.com,Full Time;Co-op;Internship,Bachelors;Masters,,,Computer Engineering;Computer Science,,,N,none at this time
Ariel Corporation,http://www.arielcorp.com,"Ariel Corporation is a rapidly growing, dynamic and innovative manufacturer of gas compression equipment.  We set the standard through Design Integrity, Technology, Manufacturing Excellence, Relationships, Customer Support, and Traditions.  Our work environment of teamwork, flexibility, continuous improvement, and ongoing employee development make Ariel an ideal work setting to take your career to the next level in an open and fun atmosphere.",Valerie Sigman,College Recruiter,"35 Blackjack RoadMt. Vernon, OH  43050",740-397-0311,740-397-3856,vsigman@arielcorp.com,Full Time;Co-op,Bachelors;Masters,,,Fluid and Thermal (G);Mechanical,,,N,"Mt. Vernon, OH "
"Hyland Software, Inc.",http://www.hyland.com/careers,"Hyland Software, we’re not like other software companies. We’re a smart group of techno-geeks fanatical about helping our customers make their paper and information work harder. Oh yeah, we like to have a little fun along the way, too. Developers of OnBase and providers of professional services, Hyland calls Cleveland, Ohio, home. Our story is one of relentless resourcefulness, always looking for a way to deliver a simpler, more seamless solution.Hyland offers dynamic, rewarding career opportunities in a variety of areas across our organization. These careers are in specialties as diverse as software engineering, quality assurance, software testing, technical support, implementation services, solution consulting, sales, marketing and more. And what’s even better? Hyland is growing! Please visit http://hyland.com/careers to get an inside view of who we are and why Hyland is a great place to work.  ",Sarah Justice,Recruiter,"28500 Clemens RdWestlake, OH 44145",440-788-4898,440-788-4998,sarah.justice@hyland.com,Full Time;Co-op;Internship,Bachelors;Masters,,,Computer Engineering;Computer Science,MBA (G),,Y,"Westlake, OH"
Cleveland Sight Center Highbrook Lodge,http://www.ClevelandSightCenter.org,"Cleveland Sight Center Highbrook Lodge is Ohio's camp for children, families, and adults who are blind or have low vision. Established in 1928, Highbrook Lodge focuses on orientation and mobility, using adaptive technologies, and all programming includes an emphasis towards independent living skills. Traditional camp activities are adapted to be inclusive including arts and crafts, swimming, music, dance, sports and recreation. Come and see camp differently!",Bob Kochmit,Camp Manager,"Cleveland Sight Center1909 East 101st StreetCleveland, OH 44106",216-658-4596,216-791-1101,rkochmit@ClevelandSightCenter.org,Part-Time;Full Time;Practicum;Internship,Bachelors,,"All Arts, Humanities, & Social Sciences",,,,Y,"Chardon, Ohio"
Integrated Mill Systems,http://www.integratedmillsystems.com/,"Integrated Mill Systems, Inc. (IMS) was founded in 1992 for the purpose of providing process control and automation engineering to the Steel Industry independent of specific Electrical or Mechanical equipment suppliers.  By remaining independent, IMS can offer the most efficient, cost effective, and open automation systems and process control solutions based upon the customer and project requirements, not upon a proprietary product line.  The customer, by not being locked into a proprietary system, has the flexibility and freedom of maintaining or modifying their system independently.Integrated Mill Systems is looking for automation and controls engineers for our main office in Eastlake, Ohio, as well as for our satellite office in the Pittsburgh area.  You will be using state of the art technology available from companies like Rockwell, Siemens, ABB, GE Fanuc and others.",John Bennardo,Project Engineer,"34525 Melinz ParkwayEastlake, OH 44095",440-918-9900,440-918-9901,jbennardo@integratedmillsystems.com,Full Time;Co-op,Bachelors;Masters,,,Chemical;Computer Engineering;Electrical;Systems & Control,,,Y,"Eastlake, OH and Pittsburgh, PA"
The MetroHealth System,http://www.metrohealth.org,"MetroHealth is an academic health care system committed to our communities by saving lives, restoring health, promoting wellness, and providing outstanding, life-long care accessible to all.",Brett Erhardt,Jr. Financial Planning Analyst,4229 Pearl Road,216-957-2585,216-957-2104,berhardt@metrohealth.org,Part-Time;Full Time;Practicum;Co-op;Internship,Bachelors;Masters,,All Sciences;Mathematics/Statistics,Computer Science,All Weatherhead,Mandel Center for Nonprofit Organizations (G),N,"Cleveland, OH"
Concurrent Computer Corporation,http://www.ccur.com,"Concurrent’s data collection and management software empowers service providers to make sense of viewer and content consumption and operational data, and harness the full potential of the video stream. Based on a deployed advanced media data infrastructure and working with industry-leading partners in the audience measurement and analytics domains, service operators are able to identify new opportunities for video revenue growth. Concurrent's unique portfolio offers census-level, cross-medium, and cross-services data management solutions which are deployed in 265 international markets and cover over 32 million digital households worldwide. In North America, Concurrent's data solutions cover 80% of the on-demand footprint.",Will Lazzaro,Director of Engineering - MDAS,"30775 Bainbridge Rd., Suite 100Solon OH,  44139",440-519-8271,,william.lazzaro@ccur.com,Full Time;Practicum;Co-op;Internship,Bachelors;Masters;Doctoral,,Mathematics/Statistics;Physics/Astronomy,All Engineering,,,Y,Solon Oho
"Acumen Solutions, Inc.",http://www.acumensolutions.com,"Acumen Solutions, a leading international consulting firm since 1999, helps the Fortune 500 and government agencies solve their complex business and technology problems. We are expanding our footprint to the mid-west and opening a Technology Center in Cleveland, Ohio. Initially, this Technology Center will deliver critical development and support solutions to our project teams across the U.S. and in Europe. Beginning in 2011, we will also provide our traditional consulting services and full solution set to clients throughout the mid-west. ",Larry Fisher,Sr. Recruiter,"Independence Center6100 Oak Tree Blvd, Ste 200Independence, Ohio 44131",216-328-2182,,lfisher@acumensolutions.com,Full Time,Bachelors,,,Computer Engineering;Computer Science,,,Y,"Cleveland, Ohio"
"Fives North American Combustion, Inc.",http://www.namfg.com,"The need for combustion touches nearly every consumer product at some point in its production process; the resources for and products of combustion are global by their very nature.Through a comprehensive array of burner products, process controls, and installation and engineering services, we offer our customers increased production, improved quality, high efficiency, and low environmental emissions.From designing melting furnaces for aluminum recycling to low NOx steam generation for enhanced oil recovery, Fives North American Combustion is known as one of the most trusted names in combustion worldwide.","John J. Nowakowski, P.E.",Combustion Engineer,"4455 East 71stCleveland, OH 44105",216-271-6000,216-641-7852,john.nowakowski@fivesgroup.com,Full Time;Co-op;Internship,Bachelors;Masters;Doctoral,,Chemistry/Natural Sciences;Mathematics/Statistics;Physics/Astronomy,Aerospace;Chemical;Computer Engineering;Electrical;Engineering Physics (U);Fluid and Thermal (G);Mechanical;Systems & Control;Computer Science,,,Y,"Cleveland, Ohio (USA)"
Northeast Ohio Council on Higher Education-NOCHE/NEOintern,http://www.neointern.net,"The Northeast Ohio Council on Higher Education's talent development initiative, NEOintern offers students, higher education institutions and employers a breadth of internship-related services, including our state-of-the-art online internship database. Students and employers connect online using the NEOintern.net system, which allows students to post profiles and resumes and Northeast Ohio employers to post unlimited internships. The database is free to use for students AND employers!",Brenda Davis Smith,Program Manager,"1422 Euclid AvenueSuite #840Cleveland, OH 44115",216-420-9200,216-420-9292,bdavissmith@noche.org,Practicum;Co-op;Internship,Bachelors;Masters;Doctoral,All Majors,,,,,Y,Throughout Northeast Ohio (16 counties)
"Phycal, Inc.",http://www.phycal.com,"Phycal is developing an integrated production system for growing algae and extracting energy products, primarily algal oil. This oil can be converted to renewable “green” jet fuel and diesel, biodiesel, fuel oil blends, and other products. Phycal’s strategic approach combines innovative technology and system engineering with a business focus on producing oil at a market competitive price. Phycal was recently awarded $24M from the Department of Energy","Bernadette Armbruster, PHR",Director of Human Resources,"51 Alpha ParkHighland Height, Ohio 44143",440-460-2499,440-460-2478,bernadette.armbruster@phycal.com,Co-op;Internship,Bachelors;Masters,,Biochemistry;Biology/Systems Biology/Evolutionary Biology;Chemistry/Natural Sciences,Biomedical;Chemical;Civil;Engineering Physics (U);Fluid and Thermal (G);Mechanical;Systems & Control,,,Y,"Cleveland, Ohio"
"RosmanSearch, Inc.",http://www.rosmansearch.com,"RosmanSearch, Inc. is a neurosurgical and neurocritical care physician recruitment firm. We work with hospitals across the country to find them the right specialist for their program.",Beth Dery,Recruiting and Operations Manager,"30799 Pinetree Road, #250Pepper Pike, OH 44124",216-287-2302,,bdery@rosmansearch.com,Full Time;Internship,Bachelors;Masters,All Majors,,,,,N,"Cleveland, Ohio"
Ohio Citizen Action,http://ohiocitizen.org/,"Since 1975 Ohio Citizen Action has been fighting for clean air, clean water, and healthier neighborhoods.  Our organization of 80,000 members across the state has been winning campaigns for 35 years.  We've passed toxic chemical right to know laws, exposed campaign contributions and political corruption in Ohio, helped pass a federal pesticide law to protect drinking water, reduced air pollution by convincing major polluters to upgrade facilities, and have trained generations of activists and community leaders.  ",Sarah Batke,Office Manager,"614 W. Superior Ave. Ste. 1200Cleveland, OH 44113",216-861-5200,,sbatke@ohiocitizen.org,Part-Time;Full Time;Internship,Bachelors,All Majors,"All Arts, Humanities, & Social Sciences;Anthropology;Art History/Art Education;Communication Sciences (disorders)/Cognitive Sciences;English/Classics/Literature;History;Interdisciplinary Programs and Modern Languages;Music/Music Education/Theatre/Dance;Philosophy/Religious Studies;Political Science;Psychology;Sociology;Teacher Education;All Sciences;Biochemistry;Biology/Systems Biology/Evolutionary Biology;Chemistry/Natural Sciences;Geology/Environmental Studies;Mathematics/Statistics;Nutrition;Physics/Astronomy",,,Mandel Center for Nonprofit Organizations (G);Mandel School of Applied Social Sciences (social work) (G) ,N,"Cleveland, OH"
